{
  "header": { "format": "CADGF-PROJ", "version": 1 },
  "project": { "id": "proj-001", "name": "Minimal", "units": "mm" },
  "scene": {
    "entities": [
      { "id": "p1", "type": "point", "params": {"x": 0, "y": 0} },
      { "id": "p2", "type": "point", "params": {"x": 10, "y": 0} },
      { "id": "l1", "type": "line", "params": {"p0": "p1", "p1": "p2"} }
    ],
    "constraints": [
      { "id": "c1", "type": "horizontal", "refs": ["p1.y", "p2.y"], "value": null },
      { "id": "c2", "type": "distance", "refs": ["p1.x", "p1.y", "p2.x", "p2.y"], "value": 10.0 }
    ],
    "parameters": {}
  },
  "featureTree": { "nodes": [], "edges": [] },
  "resources": { "sketches": [], "meshes": [], "materials": [] },
  "meta": {"version": "v1"}
}

